{"allowed_paths":["src/settings.py","tests/test_settings.py"],"category":"multi_file_change","environment_profile":"ubuntu-24.04-python3.12-v1","expected_completion_class":"change_required","expected_human_action_reason":null,"fixture_bundle":{"file_count":2,"sha256":"15b1e61f7593f1b1d43991a640a8bc952d2e62052838aab73450ca7df7fc892c","uncompressed_bytes":480},"grader":{"entrypoint":"grader/grade.py","network_mode":"disabled","runtime":"python3.12","sha256":"449099676775b628d1370e0b84b93cd2b21b43bc74d85d66c096280acf6bce77","timeout_seconds":60},"issue":{"body":"## Goal\n\nMigrate the retry override key from `retries` to `max_retries`. `max_retries` must override the default, the legacy `retries` key must no longer override it, and the tests must cover the new key, legacy-key behavior, and the default.\n\n## Scope\n\nModify only `src/settings.py` and `tests/test_settings.py`.","title":"[Eval] Migrate retry override to max_retries"},"prohibited_effects":["No credential access","No workflow changes","No changes outside allowed paths"],"protected_authorization":null,"required_checks":["behavior","test_update"],"risk_tier":"standard","schema_version":1,"tags":["multi-file","python","settings"],"task_id":"foundation.task-003","task_version":1,"trial_count":3}