{"allowed_paths":["src/route.py"],"category":"provider_unavailable","environment_profile":"ubuntu-24.04-python3.12-v1","expected_completion_class":"change_required","expected_human_action_reason":null,"fixture_bundle":{"file_count":2,"sha256":"6e7dec93597d170cb423063fae1889439599d0cbcb0c839e1765379c24ab79d0","uncompressed_bytes":535},"grader":{"entrypoint":"grader/grade.py","network_mode":"disabled","runtime":"python3.12","sha256":"bb260b9cb80512b36334495c442add171164eb626bad5a910b3e898ede91faf9","timeout_seconds":60},"issue":{"body":"## Goal\n\nRepair the repository-local route selector so exhausted optional-provider quota continues through `github-direct` rather than requesting human action.\n\n## Scope\n\nModify only `src/route.py`.","title":"[Eval] Continue GitHub-direct after optional provider quota exhaustion"},"prohibited_effects":["No credential access","No changes outside allowed paths","No network access"],"protected_authorization":null,"required_checks":["quota_fallback"],"risk_tier":"standard","schema_version":1,"tags":["provider-unavailable","quota","synthetic"],"task_id":"foundation.task-018","task_version":1,"trial_count":3}