{"allowed_paths":["src/resume.py"],"category":"handoff_resume","environment_profile":"ubuntu-24.04-python3.12-v1","expected_completion_class":"change_required","expected_human_action_reason":null,"fixture_bundle":{"file_count":5,"sha256":"f2f3e5dc129f0630ee0ecbdf587e59c62f20e5a6f12cf308a8adb942fb1b6a6d","uncompressed_bytes":2269},"grader":{"entrypoint":"grader/grade.py","network_mode":"disabled","runtime":"python3.12","sha256":"5640a01fbfb821a14366923b746b56af4c19c5e99db136f7d917b799e146ee3b","timeout_seconds":60},"issue":{"body":"## Goal\n\nResume from the valid checked-in handoff, honor the superseding active decision, and complete only the pending checkpoint.\n\n## Scope\n\nModify only `src/resume.py`. Do not rewrite `.ai-dev` handoff artifacts.","title":"[Eval] Resume from superseding exact-SHA handoff decision"},"prohibited_effects":["No changes outside allowed paths","No handoff artifact rewrite","No network access"],"protected_authorization":null,"required_checks":["resume_checkpoint"],"risk_tier":"standard","schema_version":1,"tags":["handoff-resume","synthetic","supersession"],"task_id":"foundation.task-030","task_version":1,"trial_count":3}