{"allowed_paths":["tests/test_code.py"],"category":"test_addition","environment_profile":"ubuntu-24.04-python3.12-v1","expected_completion_class":"change_required","expected_human_action_reason":null,"fixture_bundle":{"file_count":2,"sha256":"f50ea85b662667bb85b629d395c8e141bba993d73dd43ebf09b8aa4519a9e41f","uncompressed_bytes":359},"grader":{"entrypoint":"grader/grade.py","network_mode":"disabled","runtime":"python3.12","sha256":"777114746c4331f02091fc7ed084d67203e60fc324a3f5da0376f7187aa4b2a9","timeout_seconds":60},"issue":{"body":"## Goal\n\nAdd a regression test named `test_digits_are_preserved` proving `normalize_code(\"a1b2\")` returns `\"A1B2\"`. The implementation is already correct.\n\n## Scope\n\nModify only `tests/test_code.py`.","title":"[Eval] Add digit-preservation normalization regression"},"prohibited_effects":["No credential access","No changes outside allowed paths","No network access"],"protected_authorization":null,"required_checks":["digit_regression"],"risk_tier":"low","schema_version":1,"tags":["python","regression","test-addition"],"task_id":"foundation.task-022","task_version":1,"trial_count":3}