{"allowed_paths":["tests/test_label.py"],"category":"test_addition","environment_profile":"ubuntu-24.04-python3.12-v1","expected_completion_class":"change_required","expected_human_action_reason":null,"fixture_bundle":{"file_count":2,"sha256":"9827e3a769fb816c4dabb4a28d5d8d358d76c30f615c80c1c0f10cee52872796","uncompressed_bytes":400},"grader":{"entrypoint":"grader/grade.py","network_mode":"disabled","runtime":"python3.12","sha256":"aa7f08adcb9599955acaa383bc00d1af78301026450fffed5a95d96eb6eeaafa","timeout_seconds":60},"issue":{"body":"## Goal\n\nAdd a focused regression test proving tab whitespace collapses to one space. The implementation is already correct.\n\n## Scope\n\nModify only `tests/test_label.py`.","title":"[Eval] Add tab-whitespace regression coverage"},"prohibited_effects":["No source implementation changes","No changes outside allowed paths","No network access"],"protected_authorization":null,"required_checks":["tab_regression_test"],"risk_tier":"low","schema_version":1,"tags":["test-addition","synthetic","whitespace"],"task_id":"foundation.task-027","task_version":1,"trial_count":3}