{"allowed_paths":["src/ranges.py"],"category":"bug_fix","environment_profile":"ubuntu-24.04-python3.12-v1","expected_completion_class":"change_required","expected_human_action_reason":null,"fixture_bundle":{"file_count":2,"sha256":"d958fdfdfb43d95295e19f263eac03e2187258dc05048bc76dbd4271e71639eb","uncompressed_bytes":782},"grader":{"entrypoint":"grader/grade.py","network_mode":"disabled","runtime":"python3.12","sha256":"683b9207fdfd3340587bca48267b8d0a5a4f3874d80b6c043499184ac29687eb","timeout_seconds":60},"issue":{"body":"## Goal\n\nRepair `clamp` so in-range values are unchanged, low values clamp to the lower bound, high values clamp to the upper bound, and invalid intervals still raise `ValueError`.\n\n## Scope\n\nModify only `src/ranges.py`.","title":"[Eval] Repair clamp interval behavior"},"prohibited_effects":["No credential access","No workflow changes","No changes outside allowed paths"],"protected_authorization":null,"required_checks":["unit_tests"],"risk_tier":"standard","schema_version":1,"tags":["bounded","bug-fix","python"],"task_id":"foundation.task-001","task_version":1,"trial_count":3}