{"allowed_paths":["src/policy.py","src/access.py"],"category":"multi_file_change","environment_profile":"ubuntu-24.04-python3.12-v1","expected_completion_class":"change_required","expected_human_action_reason":null,"fixture_bundle":{"file_count":3,"sha256":"81d2706c55be822ffca1768a01ca9a5b82917a07c1796efe78d35d5e17afaaa6","uncompressed_bytes":676},"grader":{"entrypoint":"grader/grade.py","network_mode":"disabled","runtime":"python3.12","sha256":"fc9edd946d6cf9253b1e1b23fb92e8896072a11836467bc878795aab614607fd","timeout_seconds":60},"issue":{"body":"## Goal\n\nNormalize active state through the shared policy helper and make access reuse that helper instead of duplicating the predicate.\n\n## Scope\n\nModify only `src/policy.py` and `src/access.py`.","title":"[Eval] Reuse normalized shared access policy"},"prohibited_effects":["No changes outside allowed paths","No network access","No credential access"],"protected_authorization":null,"required_checks":["shared_policy"],"risk_tier":"standard","schema_version":1,"tags":["multi-file","synthetic","abstraction"],"task_id":"foundation.task-028","task_version":1,"trial_count":3}